{
  "schema_version": "1.0.0",
  "snapshot_id": "snap-0123456789ab",
  "project_id": "demo-repo",
  "source": {
    "commit": null,
    "dirty": false,
    "manifest_sha256": "aaaaaaaaaaaaaaaaaaaaaaaaaaaaaaaaaaaaaaaaaaaaaaaaaaaaaaaaaaaaaaaa",
    "snapshot_id": "snap-aaaaaaaaaaaa",
    "exclusions": [
      ".git",
      ".env"
    ]
  },
  "environment": {
    "os": "linux",
    "architecture": "arm64",
    "runtimes": {
      "python": "3.12.4"
    },
    "image_digest": null,
    "network_mode": "CONTROLLED",
    "env_var_names": []
  },
  "resolved_dependencies": [
    {
      "name": "requests",
      "version": "2.28.2"
    }
  ],
  "tests": {
    "verified": true,
    "ran": true,
    "results": [
      {
        "id": "tests/test_a.py::test_one",
        "outcome": "PASS"
      }
    ]
  },
  "profile_id": "pytest-default",
  "eligibility": "PASSING",
  "artifacts": [
    {
      "id": "logs-pytest.log",
      "path": "logs/pytest.log",
      "sha256": "aaaaaaaaaaaaaaaaaaaaaaaaaaaaaaaaaaaaaaaaaaaaaaaaaaaaaaaaaaaaaaaa",
      "media_type": "text/plain"
    }
  ],
  "created_at": "2026-10-24T10:00:00Z"
}